[
  {
    "facts": [
      {
        "item": "item-1",
        "fact": "rule_clarity",
        "band": "written",
        "evidence": [
          "data_report.definition"
        ],
        "quote": "a short pick is when the confirmed quantity is less than the task quantity. Cancelled lines don't count. I think wrong-location scans should count too but I'm not totally sure, Priya might know"
      },
      {
        "item": "item-1",
        "fact": "input_digital",
        "band": "fully",
        "evidence": [
          "core.data"
        ],
        "quote": "everything comes from WMS pick confirmations. We can read the reporting copy. No customer or pricing data in it, just badge numbers and locations."
      },
      {
        "item": "item-1",
        "fact": "input_structured",
        "band": "80+",
        "evidence": [
          "core.data"
        ],
        "quote": "everything comes from WMS pick confirmations. We can read the reporting copy. No customer or pricing data in it, just badge numbers and locations."
      },
      {
        "item": "item-1",
        "fact": "ways_done",
        "band": "one",
        "evidence": [
          "data_report.existing"
        ],
        "quote": "Today it takes me about four hours every Monday morning to put together in Excel, by hand, from a WMS export."
      },
      {
        "item": "item-1",
        "fact": "stability",
        "band": "none",
        "evidence": [
          "core.data"
        ],
        "quote": "everything comes from WMS pick confirmations. We can read the reporting copy. No customer or pricing data in it, just badge numbers and locations."
      },
      {
        "item": "item-1",
        "fact": "documentation",
        "band": "partial",
        "evidence": [
          "data_report.definition"
        ],
        "quote": "a short pick is when the confirmed quantity is less than the task quantity. Cancelled lines don't count. I think wrong-location scans should count too but I'm not totally sure, Priya might know"
      },
      {
        "item": "item-1",
        "fact": "steps_apps",
        "band": "under_20",
        "evidence": [
          "data_report.existing"
        ],
        "quote": "Today it takes me about four hours every Monday morning to put together in Excel, by hand, from a WMS export."
      },
      {
        "item": "item-1",
        "fact": "access",
        "band": "programmatic",
        "evidence": [
          "core.data"
        ],
        "quote": "We can read the reporting copy."
      },
      {
        "item": "item-1",
        "fact": "value",
        "band": "high",
        "evidence": [
          "core.outcome"
        ],
        "quote": "I'd like short picks per picker down by a third within two months."
      },
      {
        "item": "item-1",
        "fact": "ai_applies",
        "band": "no",
        "evidence": [
          "data_report.existing"
        ],
        "quote": "Today it takes me about four hours every Monday morning to put together in Excel, by hand, from a WMS export."
      },
      {
        "item": "item-1",
        "fact": "existing_asset",
        "band": "partial",
        "evidence": [
          "data_report.existing"
        ],
        "quote": "The WMS dashboard only shows building totals, nothing per picker."
      },
      {
        "item": "item-1",
        "fact": "decision_depends",
        "band": "yes",
        "evidence": [
          "core.outcome",
          "data_report.decision"
        ],
        "quote": "the shift leads would use it every Tuesday to pick which pickers get pulled for retraining."
      },
      {
        "item": "item-1",
        "fact": "success_metric",
        "band": "measurable_with_baseline",
        "evidence": [
          "core.outcome"
        ],
        "quote": "I'd like short picks per picker down by a third within two months."
      }
    ],
    "prose": [
      {
        "item": "item-1",
        "field": "problem_statement",
        "text": "Shift leads need a daily report showing short picks per picker to target retraining and reduce errors."
      },
      {
        "item": "item-1",
        "field": "current_state",
        "text": "Sam manually builds a weekly Excel report from WMS exports, taking about four hours; the WMS dashboard only shows building totals."
      },
      {
        "item": "item-1",
        "field": "mvp",
        "text": "Automate a daily report per picker, per shift, per day, ready by 6am, using WMS pick confirmations and the defined short pick rules."
      },
      {
        "item": "item-1",
        "field": "out_of_scope",
        "text": "Exclude over picks and any customer or pricing data; cancelled lines do not count."
      },
      {
        "item": "item-1",
        "field": "mitigation",
        "text": "If the new report disagrees with WMS numbers two weeks in a row, Sam will revert to the manual spreadsheet."
      }
    ],
    "acceptance": [
      {
        "item": "item-1",
        "kind": "criterion",
        "given": "WMS pick confirmations are available and the report is generated by 6am",
        "when": "the report shows short picks per picker, per shift, per day, following the defined rules",
        "then": "shift leads can use it to select pickers for retraining",
        "evidence": [
          "core.data",
          "core.constraints",
          "data_report.definition",
          "data_report.grain",
          "data_report.decision"
        ]
      },
      {
        "item": "item-1",
        "kind": "error_case",
        "given": "the report numbers disagree with WMS pick confirmations for two consecutive weeks",
        "when": "Sam reviews the numbers",
        "then": "the report is switched off and the manual spreadsheet is used instead",
        "evidence": [
          "core.trust"
        ]
      }
    ],
    "guardrails": [
      {
        "item": "item-1",
        "kind": "kill_criterion",
        "text": "If the numbers in the new report disagreed with the WMS two weeks in a row Sam would switch it off and go back to the spreadsheet.",
        "evidence": [
          "core.trust"
        ]
      }
    ],
    "open_questions": [
      {
        "item": "item-1",
        "area": "documentation",
        "question": "Is there a written SOP or example report for short pick counting, including edge cases like wrong-location scans?",
        "who_can_answer": "Sam or Priya",
        "artifact_needed": "Sample Excel report or written SOP"
      }
    ],
    "reflect_back_text": "You need a daily report showing short picks per picker, per shift, per day, so shift leads can target retraining. Today you build it manually in Excel from WMS exports, but want it automated and ready by 6am. If the new report disagrees with WMS numbers for two weeks, you'll go back to your spreadsheet."
  }
]
