[
  {
    "facts": [
      {
        "item": "item-1",
        "fact": "rule_clarity",
        "band": "written",
        "evidence": [
          "data_report.definition"
        ],
        "quote": "a short pick is when the confirmed quantity is less than the task quantity. Cancelled lines don't count. I think wrong-location scans should count too but I'm not totally sure, Priya might know."
      },
      {
        "item": "item-1",
        "fact": "input_digital",
        "band": "fully",
        "evidence": [
          "core.data"
        ],
        "quote": "everything comes from WMS pick confirmations. We can read the reporting copy. No customer or pricing data in it, just badge numbers and locations."
      },
      {
        "item": "item-1",
        "fact": "input_structured",
        "band": "80+",
        "evidence": [
          "core.data"
        ],
        "quote": "everything comes from WMS pick confirmations. We can read the reporting copy. No customer or pricing data in it, just badge numbers and locations."
      },
      {
        "item": "item-1",
        "fact": "ways_done",
        "band": "one",
        "evidence": [
          "manual_process.walkthrough",
          "data_report.definition"
        ],
        "quote": "Today it takes me about four hours every Monday morning to put together in Excel, by hand, from a WMS export."
      },
      {
        "item": "item-1",
        "fact": "stability",
        "band": "none",
        "evidence": [
          "core.systems"
        ],
        "quote": null
      },
      {
        "item": "item-1",
        "fact": "documentation",
        "band": "partial",
        "evidence": [
          "manual_process.documentation",
          "data_report.definition"
        ],
        "quote": "a short pick is when the confirmed quantity is less than the task quantity. Cancelled lines don't count. I think wrong-location scans should count too but I'm not totally sure, Priya might know."
      },
      {
        "item": "item-1",
        "fact": "steps_apps",
        "band": "under_20",
        "evidence": [
          "manual_process.walkthrough"
        ],
        "quote": "Today it takes me about four hours every Monday morning to put together in Excel, by hand, from a WMS export."
      },
      {
        "item": "item-1",
        "fact": "access",
        "band": "programmatic",
        "evidence": [
          "core.data"
        ],
        "quote": "We can read the reporting copy."
      },
      {
        "item": "item-1",
        "fact": "value",
        "band": "high",
        "evidence": [
          "core.outcome"
        ],
        "quote": "I'd like short picks per picker down by a third within two months."
      },
      {
        "item": "item-1",
        "fact": "ai_applies",
        "band": "no",
        "evidence": [
          "core.data"
        ],
        "quote": null
      },
      {
        "item": "item-1",
        "fact": "existing_asset",
        "band": "none",
        "evidence": [
          "data_report.existing"
        ],
        "quote": "The WMS dashboard only shows building totals, nothing per picker."
      },
      {
        "item": "item-1",
        "fact": "decision_depends",
        "band": "yes",
        "evidence": [
          "data_report.decision"
        ],
        "quote": "the shift leads would use it every Tuesday to pick which pickers get pulled for retraining."
      },
      {
        "item": "item-1",
        "fact": "success_metric",
        "band": "measurable_with_baseline",
        "evidence": [
          "manual_process.walkthrough",
          "core.outcome"
        ],
        "quote": "Today it takes me about four hours every Monday morning to put together in Excel, by hand, from a WMS export."
      }
    ],
    "prose": [
      {
        "item": "item-1",
        "field": "problem_statement",
        "text": "Shift leads need a daily report showing short picks per picker to target retraining, since right now they mostly guess."
      },
      {
        "item": "item-1",
        "field": "current_state",
        "text": "Sam builds the report by hand in Excel from a WMS export every Monday, which takes about four hours; the WMS dashboard only shows building totals."
      },
      {
        "item": "item-1",
        "field": "mvp",
        "text": "Automate a daily report per picker showing short picks, using WMS pick confirmations, ready by 6am for shift leads."
      },
      {
        "item": "item-1",
        "field": "out_of_scope",
        "text": "No customer or pricing data; cancelled lines and over picks are not included."
      },
      {
        "item": "item-1",
        "field": "mitigation",
        "text": "If the new report disagrees with WMS pick confirmations for two weeks, Sam will switch back to the spreadsheet."
      }
    ],
    "acceptance": [
      {
        "item": "item-1",
        "kind": "criterion",
        "given": "The WMS reporting copy is available and contains pick confirmations.",
        "when": "The report is generated by 6am and matches WMS numbers for short picks per picker.",
        "then": "Shift leads use the report to select pickers for retraining.",
        "evidence": [
          "core.data",
          "core.constraints",
          "data_report.decision"
        ]
      },
      {
        "item": "item-1",
        "kind": "error_case",
        "given": "The report numbers for short picks per picker do not match WMS pick confirmations for two consecutive weeks.",
        "when": "Sam reviews the numbers and finds discrepancies.",
        "then": "Sam switches off the new report and returns to the manual spreadsheet process.",
        "evidence": [
          "core.trust"
        ]
      }
    ],
    "guardrails": [
      {
        "item": "item-1",
        "kind": "kill_criterion",
        "text": "If the numbers in the new report disagreed with the WMS two weeks in a row Sam would switch it off and go back to the spreadsheet.",
        "evidence": [
          "core.trust"
        ]
      }
    ],
    "open_questions": [
      {
        "item": "item-1",
        "area": "data_report.definition",
        "question": "Should wrong-location scans always count as short picks, or are there exceptions?",
        "who_can_answer": "Priya (DC manager)",
        "artifact_needed": "Written rule or confirmation from Priya"
      },
      {
        "item": "item-1",
        "area": "core.constraints",
        "question": "Should the report be ready by 6am or 7am, and who needs it first?",
        "who_can_answer": "Priya (DC manager)",
        "artifact_needed": "Confirmation of timing requirement"
      }
    ],
    "reflect_back_text": "You need a daily report showing short picks per picker so shift leads can target retraining. Right now you build it by hand in Excel, which takes four hours and only gives building totals. If the new report disagrees with WMS for two weeks, you'll switch it off and go back to your spreadsheet."
  }
]
